,DateOnly,Title
0,31/10/2025,starbucks ceo brian niccol rules out a value menu as chain revamps
1,31/10/2025,"earnings live: amazon stock soars, apple pares gains with earnings from ai players to come"
2,31/10/2025,sbux q4 earnings sees first global comp growth in seven quarters
3,31/10/2025,what's brewing for starbucks after mixed q4 earnings? etfs in focus
4,31/10/2025,"earnings live: amazon stock soars, apple ceo predicts 'best-ever' quarter; exxon, chevron post strong earnings"
5,31/10/2025,chipotle struggles as customers skip the guac
6,30/10/2025,"analyst explains why he's bullish on starbucks (sbux), says ceo brian niccol's plan is working"
7,30/10/2025,"earnings live: amazon stock soars, apple ceo predicts 'best-ever' holiday quarter, reddit and coinbase rise"
8,30/10/2025,"earnings live: amazon stock soars on aws growth, apple wavers, reddit and coinbase move higher"
9,30/10/2025,starbucks is carrying out a major revamp. there are signs it's working.
10,30/10/2025,chipotle stock is crashing 15% today. should you buy the dip?
11,30/10/2025,"starbucks sales grow, chipotle's consumer woes: earnings takeaways"
12,30/10/2025,"starbucks q4 earnings miss estimates, revenues increase y/y"
13,30/10/2025,"behind the rise, fall and reinvention of unions"
14,30/10/2025,starbucks ceo on turnaround plan: i believe we are ahead of schedule
15,30/10/2025,"starbucks plans 1,000 store renovations by end of 2026 and tests out new budget prototype"
16,30/10/2025,"'back to starbucks' turnaround plan is working, ceo niccol says"
17,30/10/2025,"baristas are embracing changes at starbucks, ceo says"
18,30/10/2025,chipotle stock dives on consumer woes. why starbucks was unfazed.
19,30/10/2025,starbucks terrible quarter
20,30/10/2025,analyst report: starbucks corporation
21,30/10/2025,starbucks ceo: believe we are ahead of schedule on turnaround plan
22,30/10/2025,starbucks stock drops. earnings offer a glimpse at companys turnaround plans.
23,30/10/2025,"earnings live: meta stock tumbles, microsoft slides, and alphabet jumps as big tech earnings pour in"
24,30/10/2025,starbucks says its turnaround is starting to work
25,30/10/2025,"markets wanted a boost from earnings, fed and china talks. how powell disappointed."
26,30/10/2025,"starbucks returns to samestore sales growth, led by international markets"
27,30/10/2025,starbucks stock: analyst estimates & ratings
28,30/10/2025,target's next ceo finds a bold solution to alarming sales declines
29,29/10/2025,starbucks closes more stores in a key market
30,29/10/2025,markets fall back on fed cut - big earnings after the close
31,29/10/2025,starbucks (sbux) q4 earnings: taking a look at key metrics versus estimates
32,29/10/2025,starbucks saw positive same-store sales for the first time in almost two years
33,29/10/2025,"starbucks reports eps miss, revenue beat in q3 earnings"
34,29/10/2025,starbucks (sbux) q4 earnings lag estimates
35,29/10/2025,microsoft hit with global outage to azure and 365
36,29/10/2025,"chipotle stock drags on q3 revenue miss, sales guidance cut"
37,29/10/2025,"starbucks reports global sales rebound, offsetting earnings miss; shares tick up"
38,29/10/2025,"starbucks misses earnings, but stock rises on revenue improvements"
39,29/10/2025,starbucks (nasdaq:sbux) surprises with q3 sales
40,29/10/2025,starbucks beats q4 revenue estimates as global sales rise
41,29/10/2025,starbucks puts up a surprise same-store sales gain - its first in seven quarters
42,29/10/2025,"earnings live: meta stock tumbles, microsoft slides, and alphabet rises as big tech earnings pour in"
43,29/10/2025,starbucks: fiscal q4 earnings snapshot
44,29/10/2025,starbucks cafe sales stabilize after year-and-a-half-long slide
45,29/10/2025,starbucks sales improve but store closures and layoffs take a bite out of profits
46,29/10/2025,starbucks reports q4 and full fiscal year 2025 results
47,29/10/2025,"starbucks investor group raises alarm over companys ongoing financial woes, labor law violations"
48,29/10/2025,can dutch bros' refinancing boost fuel its next phase of growth?
49,29/10/2025,starbucks to report earnings as investors eye progress on turnaround efforts
50,29/10/2025,starbucks stock rises after company posts first global sales increase in nearly 2 years
51,29/10/2025,"starbucks earnings miss forecasts, us sales flat as turnaround efforts continue"
52,29/10/2025,"stock market today: stocks recover after fed chair powell says year-end cut is ""not a foregone conclusion"""
53,29/10/2025,markets await fed's decision on interest rate cut
54,29/10/2025,"pre-markets advance ahead of fomc rate cut, mag 7 earnings"
55,29/10/2025,starbucks q4 earnings: what to watch from the coffee giant
56,29/10/2025,"earnings live: boeing stock slips, caterpillar surges, with results from microsoft, meta, and alphabet on deck"
57,29/10/2025,"earnings live: boeing stock slips as cash burn improves, caterpillar and verizon rise, enphase tumbles"
58,29/10/2025,boyu capital is frontrunner for controlling stake in starbucks china
59,29/10/2025,"trump-xi meeting, microsoft earnings, fed rate decision: still to come this week"
60,29/10/2025,"alphabet, meta and microsoft headline a very busy day of earnings"
61,29/10/2025,"stock market today: s&p 500 and nasdaq eye new record highs, dow stalls, ahead of expected fed rate cut and earnings from meta, microsoft and alphabet; gold recovers the $4,000 mark."
62,29/10/2025,"the list of major companies laying off staff this year includes amazon, starbucks, oracle, nike, carter's, and more"
63,29/10/2025,starbucks' overhaul is in the works. earnings will show that turnarounds take time.
64,28/10/2025,"microsoft earnings, fed decision, trump-xi meeting: what to watch"
65,28/10/2025,5 must see earnings charts that aren't mag 7 stocks
66,28/10/2025,starbucks: what to know before the coffee giant's q4 earnings
67,28/10/2025,"new record closing highs ahead of fed cut, mag 7 earnings"
68,28/10/2025,"earnings live: wayfair stock soars following q3 results, paypal rises, royal caribbean slides"
69,28/10/2025,jim cramer discusses starbucks (sbux) ceo's turnaround efforts
70,28/10/2025,"ups stock rallies after company discloses 48,000 layoffs in multibillion-dollar savings push"
71,28/10/2025,7 brew leads coffee industry in traffic as qsr segment continues to struggle
72,28/10/2025,starbucks baristas weigh strike vote ahead of red cup day
73,28/10/2025,"tuesdays top 10 wall street analyst upgrades and downgrades: crowdstrike, starbucks, constellation energy, mcdonalds and more"
74,28/10/2025,"terminator, governor, and now, billionaire. a friendship with warren buffet and 'incredible investments' puts arnold schwarzenegger in exclusive club."
75,28/10/2025,"earnings live: paypal stock soars on openai partnership, ups surges, unitedhealth pops"
76,27/10/2025,what to expect from starbucks's (sbux) q3 earnings
77,27/10/2025,"earnings live: keurig dr. pepper stock pops, waste management and whirlpool slip with big tech results on deck"
78,27/10/2025,"coffee rally sparks stock moves. what the charts of keurig dr pepper, starbucks, dutch bros say."
79,27/10/2025,"jim cramer on starbucks earnings: ""i don't expect a lot of great commentary"""
80,27/10/2025,starbucks to post q4 earnings: what's in the cards for the stock?
81,27/10/2025,"earnings live: keurig dr. pepper stock pops as investors await big tech earnings from apple, google, and more"
82,27/10/2025,option volatility and earnings report for october 27 - 31
83,27/10/2025,which is a better income stock -- coca-cola or starbucks?
84,26/10/2025,popular 49-year-old pizza chain files for chapter 11 bankruptcy
85,26/10/2025,49-year-old favorite pizza chain files for chapter 11 bankruptcy
86,24/10/2025,"target plans layoffs, eliminating 1,800 roles, as new ceo michael fiddelke aims to reset the struggling retailer"
87,24/10/2025,"target is eliminating 1,800 roles as new ceo michael fiddelke gets set to take over the struggling retailer"
88,24/10/2025,unlocking q4 potential of starbucks (sbux): exploring wall street estimates for key metrics
89,23/10/2025,starbucks union set to vote on strike authorization
90,23/10/2025,starbucks pilots new north american store role
91,23/10/2025,shake shack (shak) reports next week: wall street expects earnings growth
92,23/10/2025,investors heavily search starbucks corporation (sbux): here is what you need to know
93,22/10/2025,should you buy starbucks stock before oct. 29? here's what ceo brian niccol might have in store for investors
94,22/10/2025,secret starbucks ai barista
95,22/10/2025,"corcoran group ceo says gen zs housing market struggles mirror what boomers faced 30 years ago: stop buying starbucks coffee, she advises"
96,22/10/2025,earnings preview: starbucks (sbux) q4 earnings expected to decline
97,22/10/2025,"jim cramer says ""it is time to buy starbucks, not to sell it"""
98,22/10/2025,starbucks poised to hire around 8k assistant mangers
99,22/10/2025,starbucks pilots assistant managers at 62 stores
